{
  "schema_version": "v2-w3-runtime-1",
  "plan_id": "ap-20260512-w3day1b-d1-runtime-001",
  "source_diagnostic_id": "diag-20260512-w3day1b-runtime-007",
  "doc_snapshot_hash": "sha256:abcdef0123456789abcdef0123456789abcdef0123456789abcdef0123456789",
  "preview_only": false,
  "patches": [
    {
      "patch_id": "p1",
      "kind": "paragraph-replace",
      "target": {"paragraph_id": "swpara-42", "text_hash": "sha256:1111111111111111111111111111111111111111111111111111111111111111"},
      "severity": "minor",
      "rationale": "本段冗余，去除重复表述",
      "before": "本段表述太啰嗦，重复说了好几遍。",
      "after": "本段表述简洁，无重复。"
    },
    {
      "patch_id": "p2",
      "kind": "paragraph-insert-after",
      "target": {"paragraph_id": "swpara-42"},
      "severity": "minor",
      "rationale": "前段后补充承接句",
      "after": "下文将进一步分解此论点。"
    },
    {
      "patch_id": "p3",
      "kind": "paragraph-delete",
      "target": {"paragraph_id": "swpara-43"},
      "severity": "normal",
      "rationale": "重复段落，删除以避免冗余"
    },
    {
      "patch_id": "p4",
      "kind": "paragraph-format",
      "target": {"paragraph_id": "swpara-44"},
      "severity": "minor",
      "rationale": "层级结构调整为二级标题",
      "format_changes": {"style": "Heading 2"}
    },
    {
      "patch_id": "p5",
      "kind": "paragraph-reformat",
      "target": {"paragraph_id": "swpara-45"},
      "severity": "minor",
      "rationale": "首行缩进与行间距统一",
      "format_changes": {"first_line_indent": 24, "line_spacing": 1.5}
    },
    {
      "patch_id": "p6",
      "kind": "text-range-replace",
      "target": {"paragraph_id": "swpara-46"},
      "severity": "normal",
      "rationale": "替换错别字",
      "range": {"start": 12, "length": 2},
      "before": "因该",
      "after": "应该"
    },
    {
      "patch_id": "p7",
      "kind": "text-format",
      "target": {"paragraph_id": "swpara-47"},
      "severity": "normal",
      "rationale": "强调关键术语",
      "range": {"start": 5, "length": 6},
      "format_changes": {"bold": true}
    }
  ]
}
